filename,caption
belinda-fewings-73XDjmZQo6Y-unsplash.jpg,a red and white sign
chris-robert-n-tIXOJfVA4-unsplash.jpg,a yellow sign with a curved arrow
claude-potts-ecAj_bnd6s0-unsplash.jpg,a blue sign on a road
cole-ciarlello-dLO5fuNzjN8-unsplash.jpg,a road with a sign that says buo
daniele-levis-pelusi-QSRXNv9kmus-unsplash.jpg,a pink sign post with a bunch of signs on it
firas-wardhana-9uzf-TPXVkE-unsplash.jpg,a blue street sign sitting on the side of a road
frankie-lopez-tg5Lm27cT3s-unsplash.jpg,a highway sign on a highway with a cloudy sky
greg-jewett-rvUoXTMUuRA-unsplash.jpg,a stop sign on a street
hikmet-ryzf8VX-kdI-unsplash.jpg,a stop sign on a road with a hill in the background
iman-Vaugz0s98pI-unsplash.jpg,a stop sign on a street corner with a blue sky
iuliu-illes-Sx2ivdqR9UE-unsplash.jpg,a road with a red and blue sign on it
joshua-hoehne-WPrTKRw8KRQ-unsplash.jpg,a stop sign with a white border
julian-gentile-bdFZY8nFlx0-unsplash.jpg,a street sign with a hat on it
keiron-crasktellanos-UH0vzjrG78M-unsplash.jpg,a traffic light with a red light on it
lucas-van-oort-Kk-fsP6XQcw-unsplash.jpg,a yellow and black sign
marwan-ahmed-yF7FCuCJ93s-unsplash.jpg,a street sign with a child crossing it
matt-seymour-7xjKZp5xuEo-unsplash.jpg,a sign that says road open on a street
mohamed-b-SXsgxCIDIeg-unsplash.jpg,a stop sign and a stop sign on a street
p-yh-cIvlYGZtntI-unsplash.jpg,a bunch of green leaves
paula-ann-murphy-cmOaC4kEa2g-unsplash.jpg,a sign on a road that says ev
paule-knete-qKKjDFPCts8-unsplash.jpg,a red and white triangular sign
rosie-steggles-h1OhvEIIcxs-unsplash.jpg,a yellow sign on the side of the road
sandy-millar-KhStXRVhfog-unsplash.jpg,a yellow painted family
sebastian-enrique-VWMkC5NxUU8-unsplash.jpg,a yellow sign with an arrow pointing left
shiona-das-6SkIwUjW798-unsplash.jpg,a traffic sign on a street with a sky background
viktor-talashuk-6PvHN_v0gow-unsplash.jpg,a street sign on a bricked street
yerin-seo-tY9y3I2L3vI-unsplash.jpg,a white sign on a pole
